Educational wikis,https://en.wikiversity.org/wiki/Educational_wikis,resource offers introduction use wiki education Wikiversity community keeps track education-oriented establishes outreach|constructive interactions technology activity culture processes impact Educational Wikis/constructive interactions|Constructive sub-page exploring wikis projects involved development learning resources Dr Wiki www.askdrwiki.com Ask medical goal creating collective online memory physicians fellows residents students wiki.couchsurfing.com/en/University CouchSurfing University social networking trying make www.curriki.org/xwiki/bin/view/Main/ Curriki started Scott_McNealy|Scott McNealy co-founder Sun Microsystems non-profit organisation building complete course instruction assessment K-12 wiki.idebate.org Debatepedia International Debate Education Association Edutechwiki edutechwiki.unige.ch/en/Main_Page based Switzerland explains lot technical stuff behind web ELATEwiki www.elatewiki.org E-Learning Teaching Exchange supports e-learning endeavors higher level Learning Processes Join create debate and/or summarize 
Wikiversity,https://en.wikiversity.org/wiki/Wikiversity,Introduction Wikiversity 
Bibliography and Research Methods,https://en.wikiversity.org/wiki/Bibliography_and_Research_Methods,learning project first find properly obtain sources Wikiversity may successfully conduct research Concepts learn via topic include Ethical unethical Perhaps start could say ethical reason breaks laws intended hurt one fixed position support researcher interested facts truths supporting predetermined appropriate type cite url link unique delimiting character font subscript provides links index information publisher date page number paragraph etc seems like good references coming prefer online materials convenience unanswered questions answered set instruction possibly accompanying wikibook used self-instruction class See also Research process resources Wikipedia WikiProject Wikidemia|Wikipedia Wikidemia yes harm end always justify means would eye ethics take wider environment User Coolpolitealex|Coolpolitealex 22:41 12 March 2010 UTC Learning projects 
Main Page,https://en.wikiversity.org/wiki/Main_Page,Main Page 
Data Networking/Fall 2016/Sanket Jabade,https://en.wikiversity.org/wiki/Data_Networking/Fall_2016/Sanket_Jabade,Data Networking Project implement DNS DHCP Web Server Firewall Backup webpage describe Linux project based implementation networking concepts Members 1 Sanket Jabade 2 Maheshwar Gurav 3 Prajwal Patil 4 Riteshkumar Gupta operating systems open source free system widely used almost major Telecommunication companies Anyone easily modify code use according needs different applications main aim using tried various like Ubuntu 16.04 LTS Domain Name System service similar phone-book basically translates host-name specific IP address makes easier users access website via rather remembering runs UDP uses port 53 additional services along translation host aliasing mail server load distribution Dynamic Host Configuration Protocol standardized network protocol dynamically provides parameters subnet mask default gateway machine wants communicate works DORA process i.e D-Discovery O-Offer R-Request A-Acknowledgement Step sends Discovery message request listening servers Offer pool addresses Request offered finally Acknowledge necessary web program HTTP Hypertext Transfer requests information form pages Internet World Wide called clients machines respond Servers client-server model primary Apache IIS nginx GWS currently popular one market may crash anytime due reasons increase usage heavy processes running always better backup everyday work another data recovered Hence create avoid loss 5 security either hardware software manages incoming outgoing traffic predefined set rules acts barrier secured internal outside unsecured Steps Install sudo apt-get install isc-dhcp-server radvd configure files nano package wide-dhcpv6-server Configuring Primary Bind9 bind9 bind9utils bind9-doc Configure caching name edit named.conf.options file Un-comment following lines add details syntaxhighilight lang text forwarders 192.168.1.13 192.168.1.12 Restart systemctl restart Edit named.conf.local Define forward reverse shown zone fouroseven.com type master allow-transfer also-notify 1.168.192.in-addr.arpa Create Add TTL 604800 SOA master.fouroseven.com root.fouroseven.com 10 Serial Refresh 34000 Retry 241920 Expire Negative Cache 192.168.1.14 NS slave.fouroseven.com slave www dee CNAME www.fouroseven.com client 192.168.1.20 apache2 stop start Modify page per requirement tables Persistent packages iptables-persistent Net filter persistent startup invoke-rc.d netfilter-persistent save Stop Netfilter Open rules.v4 changes INPUT 192.168.1.25/255.255.255.0 tcp dport 22 ACCEPT state NEW ESTABLISHED 80 DROP FORWARD Start netfilter 6 Check status iptables Generate pair public keys ssh-keygen rsa ssh addr mkdir Appending key cat Compress tar crontab take every minute scp www.ostechnix.com/install-and-configure-dns-server-ubuntu-16-04-lts/ help.ubuntu.com/ www.digitalocean.com askubuntu.com/questions/ Computer Networking- Top-Down Approach Fifth Edition James F. Kurose Keith W. Ross 
Getting a degree,https://en.wikiversity.org/wiki/Getting_a_degree,Wikiversity confer degrees help get degree start many distance learning courses programs Internet journey useful links Bear Guide Distance Learning www.bachelorsdegreeonline.com/ Bachelors Degree Online accredited Bachelor Degrees www.gnacademy.org/ Globewide Network Academy database connect students teachers enough open courseware material online infrastructure someone able trick organizing Goal plans academically respected end must flexible possible student take plan change meet requirements also admission gatekeepers architecture nature make attractive cheaper swap components Components program Formal book easiest part provide Hands-on training want brain surgeon physicist need hands-on include ways getting Social networks important needs access rich set social relations wikiversity Academic support includes things like financial aid health counseling academic advising career services Types assessment variety receive college-level credits including Prior recognition PLA PLAR Portfolio based Exam College_Level_Examination_Program|CLEP following schools United States credit materials www.tesc.edu/ Thomas Edison State College www.charteroak.edu/ Charter Oak www.excelsioruniversity-edu.org/ Excelsior University www.wgu.edu/ Western Governor challenge organize fits curriculum guidelines universities Phyiscs/Bachelor Science|Bachelor Science Physics Computer Science/Bachelor theory grant easy stuff already experiential harder gotten internships interacting constantly talking Creating crucial missing piece wiki provides Masters Doctoral word doctor derived Latin language means Teacher earned studying conducting research university persisted thousand years doctoral highest offered alone post-doctoral consist Doctor field See Creation Free Education 
Careers and Employment,https://en.wikiversity.org/wiki/Careers_and_Employment,Career describes individual journey learning work aspects life Employment relationship two parties one employer employee Wikipedia project designed assist learners career selection employment searches __NOTOC__ Selection One approach recognize personal preferences working people vs. things ideas data ACT organization uses four broad categories identify different careers placement www.act.org/world/world.html World Work map tests often given secondary school students United States help select determine college readiness test Job-related terminology section list terms of/related Careers Applicant Person wants job fills application applicant could anyone desire Reasons listed Employee person gets salary Employer person/company hires pays worker Job Application form complete get Reference Someone comment quality family relative due bias adult teacher friends Supervisor checks evaluates performance Volunteer donates time ability without receiving pay Blue/White Collar Jobs Blue physical labor like factory workers miners mechanics White Positions requiring color degree doctors lawyers business teachers Pink/Green Pink Office jobs usually held women secretaries receptionists Green environment Service-Oriented go something commuter Hourly Employees paid exact number hours Salaried amount every n't matter long worked Fringe benefits ways getting besides Bonuses commission expense accounts etc. want well-known reasons individuals especially teenagers Money Pay bills buy whatever Contribute Society Pride ego self-esteem satisfaction Love Get house would bored People-friendly Like essential know days/times parents decided example weekends 1:00PM 5:00PM Know going train car Rickshaw|rickshaw references phone numbers Employment/Job Interview|job interview prepare Ask around community clubs Ads newspaper Online websites Internet agencies look Go directly businesses Walk KFC ask need new Headhunter Finds company find read write speak language English Math Arithmetic Computer skills typing fast graph Able supervision trained basically keen listener keep properly sloppy punctual Restrict emotions workers/boss nasty Dress appropriately waste workplace good attitude Respect others even Search Hunting/ Recommendations/ See Also Astronomy Finance banking Entrepreneurship involve creating self ACT.org www.reddit.com/r/jobs/ Reddit www.reddit.com/r/careerguidance Guidance www.reddit.com/r/resumes Resumes References Professional development 
Careers and Employment/Job Hunting,https://en.wikiversity.org/wiki/Careers_and_Employment/Job_Hunting,Part series guides Career services unfamiliar term job hunting|job hunting read article Wikipedia enlighten basic process find full time expect work 40 hours week least Know type might interested qualified follows Make finding Expect devote considerable amount n't give employment e.g searching Indeed|Indeed know willing accept working w McDonalds|McDonalds software engineer Google|Google Create resume|resume cover letter|cover letter able fill application|job application Fill applications and/or send resumes letters Get interview|interviews Go interviews Accept Remember Resume writing number go mechanics resume unnecessary However psychology sometimes difficult write One key trick 30 second commercial autobiography think becomes adding removing things means making commentary life much easier coming jingle piece promotional literature marketing tool personal document tips suggestions attractive main good Use Titles/Headings match jobs applying design Mention skills knowledge experience list training education Describe accomplishment Quantify use power words Analyze description Identify Tweak target Pages moved Wikibooks| Occupations links technical-interview.com/Resume.aspx Tips www.dummies.com/how-to/content/five-tips-for-better-resume-writing.html Five Better Writing Dummies.com www.indeed.com/ Indeed search engine www.designresearch.org.uk/ Design Research example resume/CV 
Homeschooling,https://en.wikiversity.org/wiki/Homeschooling,Wikiversity central resource Homeschooling|Homeschooling basics Homeschooler Project.jpg|thumb|right Homeschooling method childhood education eschews mainstream mass schooling form government private schools keeps responsibility implementation directly hands child parents homeschoolers believe provide children home better preparation adulthood institutional options available diverse movement stretching across economic racial religious political groups vary reasons philosophies homeschooling methods employed equally family chooses best suits circumstances Though generalizations made perhaps one say whole find inefficient use time individual parental rights supersede interest homeschool desire give superior reserve right define Parents choose may enough demanding rigorous moving quickly slowly unsafe confining intrusive unresponsive legal United States though regulated variously states entirely hands-off policy others require differing levels notification oversight many support information interaction learning opportunities Homeschooling|History General Information Methods often combined modified practice include Charlotte_Mason|Charlotte Mason- British educator invested life improving quality ideas led primary Networked process developing maintaining connections people communicating way another www.unitstudy.com/articles/unit_study_101.htm Unit Study defined in-depth study topic space trees cars etc takes account areas geography science history art complete immersion student see things instead bits pieces learned throughout Unschooling|Unschooling- unschoolers standard curricula conventional grading well features traditional unnecessary sometimes counterproductive maximizing Instead typically allow learn natural experiences including game play household responsibilities social Pros Cons school.familyeducation.com/home-schooling/parenting/29861.html FamilyEducation.com PROS Educational Freedom Physical Religious Closer Family Relationships Stability Difficult Times Well-Rested Kids Busy Work page2 detoured1 CONS Time Restraints Financial Limited Interaction 24/7 Team Sports Living Outside Norm Learning Materials Homeschooling/Primary school|Primary school guide Homeschooling/Secondary school|Secondary Education John Holt Ideas www.holtgws.com/ Growing Without Schools biography books web.archive.org/web/20080705201025/http JOHN HOLT ORIGINS CONTEMPORARY HOMESCHOOLING Patrick Farenga Home School Legal Defense Association official site www.hslda.org/ Reconstructionist agenda www.hslda.org/laws Schooling laws state Incomplete inaccurate Homeschool Curriculum www.ivyleagueacademy.in/ International Hyderabad Program homeschooling.gomilpitas.com/ Z Cool contains ads inclusive free commercial resources projects.propublica.org/graphics/homeschool Pro Publica Laws www.home-school.com/ World uses popups www.homeschool.com/ Homeschool.com www.homeschoolaccrediation.com National Independent Accreditation Council Programs www.home-schooling.org Sunland Christian homeschoolbase.com/ Base volunteer-driven news www.nheri.org/research.html Research Institute NHERI conducts research Resources www.familyeducation.com/home/ State References Pages moved Wikibooks| Non-formal 
Travel services,https://en.wikiversity.org/wiki/Travel_services,Tourism/Travel 
Free lance scholar/Financial,https://en.wikiversity.org/wiki/Free_lance_scholar/Financial,Add section let others plans academic budget gives idea costs free lance scholar One month US 1000/month 300/month travel Boston/NYC one week hotels 400/month books expenses possible given current internet culture much less provided web access and/or live near library possibly book store read policy paraphrase movie Good Hunting entire education boil overdue charges fees exceptionally motivated able digest information course recieve recognition work unless peer review understand basic conventions said Access becoming easier thanks Roadrunner|Roadrunner 06:52 7 August 2006 UTC Quintessential skill set little funds worked long without money become second-nature deal performance operational matters currency products services offer need attention prospective collaborators trick reduce gather resources directly nature surpluses could use welding machine made loom hand used weave guitar strap working plan build bio-dome 40 ft deep well solar-powered pump unique donut design public domain train animals play mean big piano help bandwidth life want coming together Wikiversity CQ|CQ 20:28 September 2009 Free Finance 
Ecological sustainability,https://en.wikiversity.org/wiki/Ecological_sustainability,Welcome Wikiversity Ecological Sustainability Part Practical human life|School Human Life School Advanced general studies|School General Studies Departments Like divisions subdivisions departments pages Namespaces|Topic namespace names start Topic prefix Individual used multiple schools Schools use link department cooperate develop Subdivisions large help organize related need subdivision division Template Subdivision boilerplate template Toxicology|Toxicology Permaculture|Permaculture Energy efficiency|Energy Efficiency Sustainability|Eco-Design Education|Education Ecovillage|Ecovillage Renewable energy|Renewable ecovillage.wikia.com Ecovillage Wiki Peak oil energy society also engineering storage Conservation energy|Topic Solar Storage Biological Systems Wind Green building engineering|Topic Electrical sustainability|Topic sustainability Sustainable design architecture Agricultural story 3 September 2006 Division founded March 2007 affiliated Agriculture| Agriculture April 26| 26 w:2007| studies| original participants CQ|CQ 16:48 22 December UTC Stilite|Stilite Dionysios| User_talk span style color talk Participant Date w:2007|2007 w 26|04-26 26|April Time 174101 UTC|UTC Megercliff|Frederick 04:02 1 2008 Interdisciplinary studies Pages moved Wikibooks 
Physics Bachelor of Science,https://en.wikiversity.org/wiki/Physics_Bachelor_of_Science,"Wikiversity not|Wikiversity confer academic degrees/diplomas/certificates etc See twofish.wordpress.com/the-open-architecture-degree/ theory behind degree Part Physics Astronomy|School Astronomy current degrees Physics/Getting physics graduate school|Getting school Links www.unisa.ac.za/ South African University w/ via mail archive.is/20130630110838/www.time.com/time/magazine/article/0,9171,1226150-5,00.html mitworld.mit.edu/video/373/ Woodie Flowers liberal education 21st century www.aau.edu/education/Merkel.pdf Undergraduate Research Help wanted Need comments following People familar Thomas Edison State College Charter Oak procedures Anyone gone going program undergraduate schools interesting taking admission committees employers Students potential students find plan attractive people may need beta testers crazy enough try page came wikimania 2006 effort put together curriculum get accreditted Bachelor Science using free speech materials actual issued call brokerage i.e someone like turns life experience credits involve lot investigation little details thing important see one could provide getting crucial bit involves working research lab internship part actually book work since letters recommendation really doctoral ask opinions Also something would useful list whether even think applying wikiversity internships look take also input professional societies AAS AIP months wiki feel add contributions sketch fill material Roadrunner|Roadrunner 07:23 7 August UTC basic links TESC www.tesc.edu/prospective/undergraduate/degree/ba.php www.charteroak.edu/Prospective/Programs/Concentrations/Physics.cfm Excelsior www.excelsior.edu/portal/page _pageid57,55694 _dadportal _schemaPORTAL MIT web.mit.edu/physics/undergrad/index.html One especially changed main point grad case 1991 creating requirement know problem possibly self-defeating works hundreds thousands qualified massive expansion bad means project less complete next step figure massively expand gets social priorities want discussions funding goes challenge scale trick reason good able quality millions twenty year olds hard generating networks communities learning skeleton Basic Strategy strategy use Course 8 template match requirements either issue final easy proxies expertial networking occurs require sort intership tutorial model finding already exist building n't 07:55 Focused Option VIII focused option designed best possible preparation study Many found excellent broad based related fields astrophysics biophysics geophysics many engineering disciplines unusual among pre-professional programs offers particularly large amount elective freedom six subjects chosen unrestricted electives without exceeding minimum Departmental consists required restricted full including General Institute Requirements Bulletin Required Subjects 8.03 III vibrations waves 18.03 18.034 Differential Equations 8.033 Special relativity 8.04 Quantum mechanics/Course|Quantum mechanics 8.044 thermodynamics|Statistic 8.05 Mechanics II 8.06 CI-M 8.13 Experimental 8.14 8.ThU Project Restricted Electives subject given Mathematics Department beyond Two additional 8.02 least 8.07 8.08 Classical 8.09 Notes student read understand papers Nobel Prize-winner Gerard Hooft called Become Good Theoretical Physicist www.phys.uu.nl/~thooft/theorist.html Textbooks List textbooks textbookrevolution.org/tag/physics/ sucker site attempted download zip version Electromagnetism Field Theory alleged equivalent classic field authored Jackson received nothing except long lists advertisement commercial products lazyquasar books mentioned derian link textbookrevolution great open course content opencontent.org/ocwfinder/ findings http sure fit throught RichMac Replicating sound haliography demystify lots things go anything ca replicated architecture goal replicating subfactors teamwork support key form incredibly supportive much way weed mentality pass rates quite high constantly complain professors awful teaching group obstacle emulating mutual homework help ahem efficient enter equations online show peers partially-completed LaTeX looks pretty perhaps fastest typeset real fountain pen parchment paper prof. moderately evil prof expects memorized Navier-Stokes equation spherical-tensor totally makes pointless contour integrals timed constraints Exams book-itchy fingers exams anyway proctored virtual bot advanced computational Mathematica example allowed Phoenix illustrated team pace pressure huge cooker results type personalities place New York City nice teaches manage stress replicate needs done carefully safety nets available overwhelmed difficult physical environment dark disappear architectures assumption responsibility campus serious medical issues assumes harder rich environments Walk hallways happening right involved walk hall vats liquid nitrogen water fountains affects thinking subtle ways science culture seminars arguing process reading writing journal articles incorporate Bad brutality element nowhere places 80-90 proud danger dangerous happens exposed gears psychologically reacts withdrawing causes downward spiral whose scalability flexibility currently exists full-time effects 19 teach deal 35 probably learned career naturally attract driven busy stressed minds informal multiple choice tests evaluation consist hand graded individually assignments classes Encouragement Summer Internships Note NSF REU stuff interested handle older average www.aas.org/career/Summer.html www.yale.edu/yser/links/extramural.html www.phds.org/graduate-school/undergraduate-research/ www.phds.org/graduate-school/undergraduate-research/summer-internships-2/ www.nsf.gov/crssprgm/reu/list_result.cfm unitid69 NSF-funded Programs Pages moved Wikibooks| "
Independent Print Publication,https://en.wikiversity.org/wiki/Independent_Print_Publication,Course Description overview history independent print media Practical considerations production political social ramifications Technologies used Contents Media Newspapers Magazines|Underground Magazines Presses|Small Presses Readings Projects Make meta-zine technology available alters ability communicate world Outside World 
Internet Publication,https://en.wikiversity.org/wiki/Internet_Publication,Internet revolutionized way information flows society course focuses exploring evolution structure democratizes sources knowledge attempt fuse media theory computer programming political science synthesis potential technologies make public life participatory egalitarian liberated Projects MediaWiki Project guides participants introductory HTML developing features Wikiversity community department School Engineering Technology understanding using software Wiki learning project devoted use wiki technology facilitate online Free peer reviewed journals directory Bibliography Research Methods find properly obtain successfully conduct research Publishing original Readings Open Source|Open Source Science|Wiki Science Links freenetproject.org/ Freenet www.eff.org/ Electronic Frontier Foundation Media 
Media Analysis,https://en.wikiversity.org/wiki/Media_Analysis,Course Description media biased controls content television radio newpapers magazines websites aims ulterior motives owners outlet Readings Manufacturing Consent Noam Chomsky Media Monopoly Ben Bagdikian Projects following companies report National Amusements owner Viacom CBS Viacom|Viacom Assets List_of_assets_owned_by_CBS|CBS General Electric NBC List_of_assets_owned_by_General_Electric|GE News Corporation FOX News_Corporation|News Holdings Walt Disney Company The_Walt_Disney_Company|Disney Time Warner Magazine AOL CNN List_of_assets_owned_by_Time_Warner|Time Outside World www.indymedia.org Independent Center www.adbusters.org Adbusters 
