Wikiversity the Movie/Script outline,https://en.wikiversity.org/wiki/Wikiversity_the_Movie/Script_outline,Feel free make suggestions Wikiversity Movie/Script outline|discuss ideas discussion page Manifesto10.png|thumb|right|400px| w Free Culture movement|Free Manifesto Teaser Transwiki Wikimania05/Presentation-JW1|Jimmy Wales video Jimmy talk Curriculum History Wikiversity|History A. start history educational technology power printing|writing printed books Ward Cunningham|Ward Cunningham inside Wikibooks en.wikibooks.org/w/index.php titleWikiversity diff32132 oldid32014 origin schools 19 May 2004 two project proposals Jimbo movement|things launch August 2006 use audio making announcement month beta period Original research|original research Disclosures|exclusions NPOV B Content creation Education|Learn Learning groups|learning groups Portal Projects|learning projects wikiprojects content development pages School Topic namespaces www.archive.org/details/Wikiversity_Reports_WikiProjects podcast C. Featured|Featured nominate examples best described movie might several short live-action sequences think live action scene part b way actor explain everything web explaining printing Wittenberg Schlosskirche.JPG|thumb|right|All Saints Church teaser introductory analogy revolution caused Web 2.0 October 31 1517 Martin Luther|Martin Luther shown gathering documents moving streets Wittenberg|Wittenberg around Map Imperial Circles 1512 Holy Roman Empire voice-over year 313 emperors eastern western Empires Constantine I|Gaius Flavius Valerius Aurelius Constantinus Licinius|Flavius Galerius Licinianus Licinius jointly declared Christians could practice religion without persecution One thousand years later Catholic exerted strong influence German Nation 10 priesthood wrote set questions challenged legitimacy certain religious practices aid challenge spread rapidly led fragmentation Papal authority new Christian denominations Add impact cheap January 15 2001 Show activation Wikipedia website changing versions particular time.Show graph traffic Illustrate encyclopedia textbooks education briefly describe collaborative editing using wiki technologystate Imagine world every single person given access sum human knowledge need help possible proposal old proposal|No courses Wikimedia Foundation Board Trustees ruled-out conventional Based www.seinfeldscripts.com/ThePitch.htm Pitch episode Seinfeld|Seinfeld television show probably done actors made looks like Seinfeld characters version Part 2 nearly copyright violation label fan fiction add disclaimers 1 club Jerry Stand-up comedy|Stand-up comedy routine jokes seriously balding role WMF New Projects Developer seen audience small act approaches says would education-oriented Apartment Setting big city apartment George brain-storming Elaine Kramer used intent profit confusion actual illustrate funny approach talking respectful imitation great comedic technique GEORGE wants JERRY want name n't Come kind Look silly names come least real Well already ran past happy people wikinuts time deal pitch Hey wikiversity hard idea Start course computers millions computer nerds internet go Mmmm know Computer play games build online branching Bill Gates Getting married Curing AIDS geeks anything cache last World Warcraft level 60 domain opened since Oh yeah KRAMER enters coming along working takes bottle refrigerator tries open able keeps trying increasingly ridiculous methods continue run format getting frustrated finding practical happen Finally forcing corner twists mightily crashes floor finally notice problem aid. much noise get work picks one gamma-ray irradiated juice drinks going drink Kryptonium Berry Drink guaranteed 100 nuked-to-death microbes hermetically sealed struggles feet new-fangled bottles read technical jargon-filled instructions try figure remembers ELAINE mentioned knowing inventor opener end contact ELAINE. chat Hi guys explains opening disparaging remarks suggests look surfs Juice Drinks article. list flavor types googling finds solution searching adds trick article Wikipedia. figuring things dismissing Yeah right really serious good webpages together whole Forget got ta learning participants Anyone participant program game called something wrong science department collaborate learn else Help desk|help desk knows find Wiki Ask even channels quick mean homework baby community points Absolutely bored saying tell Since developer Scoffs Website crazy still Right Everybody Exactly say moment passes Nodding may 3 reception area waiting matter Nervous Nothing sure nervous fine beat snaps ca Ca tried impossible said listen Dont worry men jobs wear sweat pants tee-shirts Mediawiki markup registered usernames multiple sockpuppets told RECEPTIONIST ready gulps walks Inside large board table sitting suits leans whispers wearing JIMBO WALES Mr. Sanger Flailes take seat Nice leather jacket sir smiles awkwardly Please note adaption decided seemed copy-and-pasted changed lines added extra school Set classroom Characters High class Camera panning window ending teaching high IT/web design bell goes stands Remember HTML tags next week lesson Alright Class dismissed walk room little boy left. question Alvin ALVIN Uhhh… Mr websites maybe Bye evening packs stuff briefcase building gets car. road/titles driving road background hear theme music see credits. university 4 Big webcam call actually put useful always helps king Anyway sort guy love word caché outdoors grimaces cuts hand across neck keep quiet gesture. floor. feet. keyboard. Just… member Think gon na nerdy pens sticking top pockets normal waits snaps. Get fail embarrass multicolored signatures met Movie| 
Basic kinematics,https://en.wikiversity.org/wiki/Basic_kinematics,hr/ Kinematics study motion objects Basic kinematic problems approached using Isaac Newton laws Laws attempted explain move assumptions possible call today remarkable stood test time almost except smallest scales quantum mechanics largest general relativity Even mostly added modified thought reasonable assume nature universe three remained used deduce fundamental equation classical physics wording altered slightly order less jarring modern student Another translation original found members.tripod.com/~gravitee/axioms.htm First Law Inertia body remains state rest uniform straight line unless compelled change forces impressed thereon point told us force law n't description bodies may think Hey know something push However contact type means deal basically statement define anything changes linear including zero allows include gravity matter fact see successfully describes terms fields similar way works pushing object actually result electromagnetic field interactions particles hand whatever never comes direct sense space another Second Acceleration quantity proportional magnitude made direction directed Newtons cradle animation book.gif|thumb| Cradle let go near ball transfers momentum far assuming friction heat losses swing height lifted first simpler 2-ball apparatus balls differing types extremely rich content devices refer note given end perfect collisions motive lift one transferred final velocity initiate also noted different imparted larger arcs thus came product mass weight preserved Today usually denote p v described Manipulating called vectors covered vector algebra talked supplementary review guide F second tells dt ordinary derivative calculus yet studied written respect known acceleration Exercise 1 bit prove total system two pool prefer constant Note case hit idealized circumstances say Third Interaction every action always opposed equal reaction mutual actions upon contrary parts Main third ACTION REACTION primarily spheres points act centers impetus allowed separate symbolic states exerts _1 _2 Using derived hard measured defining standard ratio accelerations Vectors Physical Quantities example etc Body Diagrams Free diagrams useful tools analyzing problem approaching kinematics thing draw free diagram simple sketch shows acting drawing must isolate question identify Remember sum tell opposite sitting table important concept Since neither falls flies air Motion Particle going apply single well-defined meaning without spatial dimensions mathematically later consider lot like behave classically interact along talk sphere-like center-of-mass freely show sentence accurate developed familiarity take hold distance floor stop holding fall According inertia could done acted inertially downwards besides Due experience falling ground hypothesize Earth exerting exert Derivation basic Physics Learning activities 
Political science,https://en.wikiversity.org/wiki/Political_science,Part Strategic_Studies|Strategic Studies curriculum Political Science rudimentary terms study power considered social science interdisciplinary nature interconnectedness many fields must viewed compared contrasted though relative field order fully understand subject matter relates way humans organize working society interest public good advance benefit whole process known collective action able live fairly justly observes aspects societies accomplish goal four major addition usually studies along Anthropology w Economics Geography Religion Philosophy Psychology Sociology Theory theory|Political one explore analyze philosophy chosen government construct laws achieve desired goals Economic Social Theorists compare contrast theories others simply different political see well meet needs people theory created may Government Politics explores product nations studying important carefully consider meant function institutions Many types explored briefly Depending country student dominated in-depth analysis structure Comparative Unlike comparitive politics students given two governments asked conduct form either beneficial burden type yielding International quite new However dates back Ancient Greece relationship individual city-states looks work cooperate coexist increasingly international community topics include Law|Law Relations Organization Global Economy Foreign Policy See also Indian science| Introductions Strategic Studies| 
Main Page/Concept/2006/August,https://en.wikiversity.org/wiki/Main_Page/Concept/2006/August,__NOTOC__ __NOEDITSECTION__ Column Sections class radius_bottom style font-family Verdana Arial Helvetica sans-serif font-size x-small background-color border:2px solid border-top:0 padding:0 0 30px Help|Help Wikiversity Contact|Contact nbsp SisterProjects languages may read edit courses many different sister projects div clear left de 
Science as religion,https://en.wikiversity.org/wiki/Science_as_religion,Hildegard von Bingen Liber Divinorum Operum.jpg|thumb|200x200px| Operum 13th century Welcome Religion learning project offers activities help us understand relationship science religion Concepts learn include nature uses seminar format Participants explore published literature topic write discuss essays Materials|Learning materials Wikiversity adopted model education Lessons center participants Learning projects used multiple Cooperate departments use resource Discussion www.renewamerica.com/columns/alba/060811 article Bonnie Alba amazing parents continue cede Darwinism public schools take children church Sunday eebweb.arizona.edu/courses/ecol409_509/rambaut04.pdf Causes Consequences HIV Evolution http Nature Reviews Genetics Volume 5 pages 52-64 2004 Theory Gravity web.archive.org/web/20131210175418/http Science God Gene exist Smaller_Budda_Brot.jpeg|thumb|300px|The Buddabrot Create reading list Start discussions activity suggested associated background selection casting evolution ism doctrine belief considered pejorative term links.jstor.org/sici sici0006-3568 199409 44 3A8 3C560 3ADDAR 3E2.0.CO 3B2-1 Review Darwinian Paradigm Essays History Philosophy Religious Implications www.archive.org/search.php querycollection 3A 22podcast_evolution101 22 20AND 20 28 28collection 3Apodcast_evolution101 20OR 20mediatype 29 20-mediatype 3Acollection 101 Zachary Moore etc Additional helpful readings links web.archive.org/web/20090627073218/http 20on.htm Papers authored Rustum Roy including Scientism technology religions www.sciencejummah.com/ Jummah platform faith Islam religion| Forums 
Fundamentals of computational chemistry,https://en.wikiversity.org/wiki/Fundamentals_of_computational_chemistry,page deals developing materials related Computational chemistry text book written another Mathematics books contain student exercises Project Chemistry project two objectives 1 produce educational molecular level models wood lignite coal 2 review article modelling clean processes beginnings exist Academic Publishing Wiki wiki Interpretations Physical Sciences Contributions solicited particularly open source code used discussion see Fundamentals computational whole new learning planned develop links five modules Introduction modeling approximate quantum Basic qualitative structure activity relationships ab initio mechanics dynamics Computer programming 
College Algebra/Grammar quiz,https://en.wikiversity.org/wiki/College_Algebra/Grammar_quiz,self quiz text Algebra/Grammar displaysimple points 1/1 following could variable constant represents specific number y2x+4z-5k depend dependent x z k independent variable|independent equation x2y+3z-5k monomial like 3x two monomials added/subtracted added subtracted Using distributive property equal 5 3+2+10 3 10 must multiplied something 2 set subset 1 7 member original 9 4 natural numbers Return College Algebra Quizzes Category Learning activities 
Classical Mythology,https://en.wikiversity.org/wiki/Classical_Mythology,Tunisia-4752_-_Pontus.jpg|thumb|A mosaic w Tunisia|Tunesia showing sea god Pontus mythology Introduction Welcome Classical Mythology course part Comparative Mythology|School Wikiversity provides general introduction myths Ancient Greece Rome including overview myth theories brief looks mythologies Egypt Mesopotamia end students able define distinguish narrative forms narrate basic events Greek creation world people identify describe Olympians important deities compare Roman use modern explain ancient connect Mediterranean beyond expand independent modules Myth Lessons nbsp Conceptual Overviews Mythology/What Mythology/Historical Background| Background Mythology/The Birth Gods| Gods Mythology/Creation Humans| Humans Mythology/Zeus| Mythology/Apollo| Mythology/Hermes Hephaestus| Hephaestus Mythology/Love Fertility Power Aphrodite| Aphrodite Mythology/Warlike Women Athena Artemis| Artemis Mythology/Demeter Vegetable Fertility| Mythology/Dionysus Identity| Identity Heroes Mythology/Orpheus| Mythology/Heracles| Mythology/Theseus Minotaur| Minotaur Mythology/Oedipus Thebes| Thebes Mythology/Jason Argonauts| Argonauts Mythology/Perseus| Epics War Origin Trojan War| Mythology/Achilles andThe Iliad| Iliad Fall Troy| Troy Return Agamemnon| Agamemnon Adventures Odysseus| Odysseus Mythology/Odysseus Land Dead| Dead Mythology/Roman Legend| Legend Mythology/Aeneas| Mythology/Romulus Remus Julius Caesar| Caesar Survival Mythology| Primordials style width 60 background-color border 1px solid vertical-align top 8px rowspan 2 Exams Ready test knowledge Go Mythology/Exams| section Instructor collaborative project HU-301 capitol-college.edu Capitol College questions suggestions feel free contact Kenmayer| Kenmayer Resources Sites www.theoi.com/ THEOI includes complete translation http Apollodorus www.maicar.com/GML/ Link impressive collection materials www.greekmythology.com/ Mythology.COM www.mythindex.com/ Index mythology|Greek article Wikipedia Sources English Translation en.wikisource.org/wiki/Theogony Hesiod Theogony en.wikisource.org/wiki/Metamorphoses_ tr._Garth _Dryden _et_al Ovid Metamorphoses en.wikisource.org/wiki/The_Iliad_ Murray Homer en.wikisource.org/wiki/The_Odyssey_ Butler Odyssey en.wikisource.org/wiki/Aeneid_ Dryden Vergil Aeneid www.oneeyedman.net/school-archive/classes/fulltext/www.mala.bc.ca/~johnstoi/aeschylus/oresteiatofc.htm Aeschylus Oresteia Introductions Print Mark P. O. Morford Oxford University Press 1999 Barry B. Powell Pearson Division 2011 William Hansen F. Guide Mythical World Greeks Romans 2005 Walter Burkert Religion Archaic Wiley-Blackwell 1991 www.amazon.com/Greek-Religion-Classical-Walter-Burkert/dp/0631156240 Amazon Interpretation Eric Csapo Theories Wiley Bruce Lincoln Theorizing Narrative Ideology Scholarship Chicago Andrew Von Hendy Modern Construction Indiana 2002 people.duke.edu/~wj25/UC_Web_Site/myth/theory.html Thought Theory wps.prenhall.com/hss_powell_classical_4/12/3094/792311.cw/index.html Study Nadia Sels www.lineofbeauty.org/index.php/s/article/view/64/137 Mind Metaphor Relation Psychoanalysis faculty.gvsu.edu/websterm/ways.htm Ways Interpreting department.monm.edu/classics/Courses/Clas230/MythDocuments/CHAD/MYTHWEB/theomyt.htm Monmouth www.utexas.edu/courses/nestor/handout_1-21.html APPROACHES MYTH SEARCH UNIVERSAL THEORY quizlet.com/15363493/interpreting-myth-flash-cards/ flashcards Quizlet www.mhhe.com/mayfieldpub/mythology/instructors_resources/harrispt1ch02.pdf WAYS INTERPRETING Classics Humanities courses 
Search techniques,https://en.wikiversity.org/wiki/Search_techniques,Purpose searching Find path desired Goal State future states possible search Uninformed also called blind unguided class general purpose algorithms operate brute-force way term additional information beyond provides problem definition.These applied variety problems since n't take account target level depth tree explored expanding nodes children Breadth- first simple strategy root node expanded successors next Uses FIFO QUEUE Advantage Simple implement Disadvantage Heavy memory requirements Breadth-first-search2.png sear Drills deep hierarchy exploring one lineage reaches child/leaf goal course Improves deleting entire line Potential run infinitely non-complete Depth-first limit Depth- always expands deepest current fringe Mitigates infinite cutting fail reach resides deeper deepening depth-first Performs iterations depth-limited searches increasing limits Unlike normal complete without greatly expected runtime Searches initial state last stopping two meet found 1.Time good comparatively 2.Less time complexity feasible backward available could guide example finding shortest route map distances places Information put evaluation function f n able give value Sometimes heuristic h used guess perfect Greed best-first Define distance Expand child lowest advantage find star plus g must admissible ie overestimate Always finds optimal solution Guided Projects Search Techniques Uninformed_Search_Project Project Make program help Homer Simpson around Springfield Simulated_Annealing_Project Simulated Annealing Gradient Descent Use simulated annealing correct placement baby lizards nursery ca eat Artificial intelligence 
Interdisciplinary linguistics,https://en.wikiversity.org/wiki/Interdisciplinary_linguistics,stuff needs go subcategories Computational Linguistics page moved learning resource Department ASAP interdisciplinary field dealing statistical logical modeling natural language computational perspective limited particular linguistics two major purposes help linguists study languages easily make possible ordinary people use using computer often large bodies digitized text speech called Text corpus corpora basis teaching programs proper compare one context another also practical uses include Speech recognition synthesis production Machine translation Improvements data mining including w search engine design Also Psycholinguistics 
Rhetoric and Composition I,https://en.wikiversity.org/wiki/Rhetoric_and_Composition_I,Literary Studies|Literary Studies Please see Unit_boilerplate information Summary code ALTU101 Prerequisites High school english investment suggestions Arts Language Literature First year undergraduate summary Welcome English 1101 Rhetoric Composition course prepare academic writing college learn skills required effective writer think rhetorically thereby tailor accommodate audience context read evaluated formal process planning drafting editing reviewing revising examine sentences make clearer and/or persuasive include research however 1102 II intended provide complete introduction concerned fundamental concepts focus development organization style conventions Understanding prerequisite outcome help refine four vital necessary good job today economy Abstraction System Thinking Experimentation Collaboration Instead learning rules formulas develop methods define methodology always know everything need starting project must along way adapting learned address new projects working alone work others manage evidence arguments present innovative manner colleagues professional audiences argument research-based settings compose multiple drafts careful revision numerous exercises sharpen editorial materials guide sample syllabi Use schedules plan progress Teachers invited copy adapt use classes www.mattbarton.net/tikiwiki/tiki-index.php pageFall+05+Intro+to+Rhetorical+and+Analytical+Writing+Syllabus Matt Barton 191 Syllabus pageFall+05+Intro+to+Rhetorical+and+Analytical+Writing+Schedule Schedule Composition|Rhetoric incomplete please Pages moved Wikibooks 
Web Writing,https://en.wikiversity.org/wiki/Web_Writing,Literary Studies Please see Template talk Unit boilerplate information __NOTOC__ Summary code ALTU Prerequisites Basic knowledge coding web design advanced writing courses investment suggestions Arts Language Literature Third year undergraduate Lesson 1 2 3 4 Based Literature/ English language Web Pages moved Wikibooks 
Introduction to Creative Writing,https://en.wikiversity.org/wiki/Introduction_to_Creative_Writing,Literary Studies|Literary Studies Please see Unit_boilerplate information Summary code LS 375CR Prerequisites however desire write recommended investment suggestions course students could submit piece week variety genres Students also encouraged read writers reviews Arts Language Literature Creative Writing summary outcome aims module engage develop understanding contemporary traditional texts including formal ideological character impact audience culture developed alongside appreciation methods research creation text thus enable student produce substantial informed portfolio critical creative writing studied context produces need fulfills materials guide Texts required basis content available online public library used obtain designed teach stimulate process create pieces use Rhetoric_and_Composition| Rhetoric Composition review improve technical aspects Assignments described syllabus one Read Allen Ginsberg www.writing.upenn.edu/~afilreis/88/america.html America short 500 words Rewrite reimagine opening submitted talk page discussion relation two T.S Eliot www.bartleby.com/198/1.html Love Song J. Alfred Prufrock Submit poem devising consider contrasts T. S. found three Angela Carter Passion New Eve introduction postmodernism researched independently exploring themes and/or techniques postmodern theory four Salman Rushdie Satanic Verses explore controversy surrounded essay/article understand postcolonialism social climate novel written received Alternatively relationship market reaches five Jeff Noon Vurt watch Pulp Fiction Consider non-linear narrative unreliable narrator drug-use crime violence sexuality loss extract influenced either genre style detailed plan longer work e.g film motifs structure characters reflects elements six Watch Legend Ultimate Edition Cut Book 1 Faerie Queene storytelling comparison Prepare EITHER analysis characterisation effect upon amongst peers argued consideration whether like could/should implications would modern literature seven Hunter Thompson Fear Loathing Las Vegas behind Gonzo journalism subject autobiography truth un/importance eight Confessions English Opium-Eater Trainspotting way present reality addiction perspective theme appropriate rewrite scene section adapt another nine Illuminatus Trilogy Write verse chapter comedy generic convention ten Plan prose poetry scriptwriting writing-for-purpose commentary intentions group considering encountered programme literary cultural language Pages moved Wikibooks Introductions Learning activities 
