Probability and statistics,https://en.wikiversity.org/wiki/Probability_and_statistics,curriculum reflects hybrid typical undergraduate graduate programs Statistics aspires provide strong foundation applied theoretical branches Generally statistics program functionally math major emphasis statistical topics Rarely student desire foresight focus field quite much okay Mentioned idea minor might stats degree perhaps someone physical sciences physics chemistry biology geology even psychology wants experimental design supplement research-oriented career cases would want tailor classes fourth semester wishes however pursue real professional considering school fifth excellent preparation anyone actually mastered entire par modern full-fledged thesis expected prepare well advance starting sixth fall hurried last minute curse Additionally write shorter summary paper submission two academic journals 0 Preparations Review conceptually collection preparatory pre-classes intended give good working starts study earnest probably qualify half-credit students already possessing background mathematics may opt test proceed directly 1|first Fundamentals Probability Experiments Data discusses history nature data types data—discrete versus continuous categorical etc discussed problems gathering unintended outside forces getting confounded Combinatorics class n't require fancy high-level computationally intensive Lots exercise brain developing muscle understand visualize issues probability later semesters Pump feel burn Pre-Statistics Topics Math Introduction Computing R review first worry pre-calculus best introduction using Open Source package programming language used institutions level 1 Introducing provides true mathematical context attempts introduce foundations avoiding rigor 2 pick material assumes understanding Calculus defines concepts spaces random variables distributions density distribution functions Independent IID independent identically distributed also ends values attempting accessible yet course calculus Research Methods Library Science today age many know use library introduced primary learn conduct research including interlibrary loan systems means accessing materials nearby really serious plans complete full necessary work Fact ca look Internet Linear Models second continuation pace previous attempt establish familiarity notation requires come soon enough half Regression reinforce restate theory Statistical Analysis lineal algebra reviews fundamental begins relate sample parallel components Sample mean variance Concepts confidence intervals hypothesis testing simple examples Theory regression presented example Optional modules solid proficiency computer encouraged introductory courses reiterated 3 Completing Basics complement focusing different aspect Whereas Experimenters data-oriented laboratory statistician time series appeal pure mathematician theorist taken concurrently mostly discussing real-world scientific Addition include practices disciplines effective writing presentation papers application preview Sampling Design hopefully encourage researchers take 4|Semester 4 Stochastic Processes Intro Time Series weak heart Major heavy extended time-dimension stationarity ARMA ARIMA kalman filter Applied Researchers arena pursuing conclude one final One natural fit depending specific Class uses built 103 explore example-heavy large amount done pre-designed sets main sampling designs explored Simple Random Stratified Importance Categorical GLIM useful social pre-med Contingency tables Logistical computer-intensive analyses performed R. 5 Advanced considered required approaches first-semester point grasp rest looks cumulative moment generating calculation expectation conditional vectors Computational Computer modeling monte-carlo kernel estimation advanced 6 Thesis Preparation plenty purely electives project consulting advisor fulling documenting kill nothing leading brought bear minimal sufficient maximum likelihood Clinical Trials clinical trials pharmaceutical industry Includes discussions Phase I-IV reading literature ie Consulting Lab geared consultant help experimenters seeking Case studies examine common misconceptions communication differences early planning late a.k.a bring meaning worthless everything acceptable levels must Bibliographies prepared detailed calendar checked 7 Work returns time-oriented acquired far generally supposed perform planned mid-experiment analysis proofs theorems readings show developed various world Bayesian Examination controversies discuss instances approach advantages Spacial Theories regularity clustering outline bibliography completed end draft journal similar state preparedness 8 Multivariate Defense defend based guided execution Everything n-dimension extension Techniques analyzing eigenvalues eigenvectors transforming orthogonal axes Mathematical optional extending next step like Weak Strong Laws Large Numbers Measure approached aspire set arguably doctoral Student mid-semester revisions submit condensed least submitted accepted 
Mathematics software,https://en.wikiversity.org/wiki/Mathematics_software,School Mathematics links page software validated verified free risk Unless otherwise noted added anonymous editors registered editor substantial contribution history willing validate certify programs please sign listing Otherwise exists research purposes suggest googling name loading find reviews unless much know To-do Validate safe Eliminate dead Review comparing Abd|Abd User talk Abd|discuss Special Contributions/Abd|contribs 13:32 4 April 2014 UTC mathematics freeware open source tools mostly available GNU/Linux run platforms www.geogebra.org GeoGebra dynamic geometry algebra calculus middle/high school college Exports interactive web pages Kig edu.kde.org/kig GUI based Includes analytical functions conic sections several formats including SVG www.flat502.com/newt Newt graphing program windows maxima.sourceforge.net Maxima symbolic maths like Mathematica Maple www.sympy.org SymPy computer written Python axiom-developer.org/ Axiom another cran.r-project.org r version S-plus statistics www.texmacs.org TeXmacs WYSIWYG LaTeX www.emacswiki.org/cgi-bin/wiki/AdvancedDeskCalculator Calc RPN calculator package numerical calculations Emacs calcpad.net Calcpad programmable engineering cloud desktop www.gnuplot.info gnuplot Linux Windows Mac www.graphcalc.com/ GraphCalc 2D/3D application padowan.dk Graph used draw mathematical graphs coordinate system www.octave.org GNU Octave Matlab clone www.stsci.edu/resources/software_hardware/numarray numarray powerful programming language www.scilab.org scilab jwork.org/dmelt/ DataMelt Java Also includes scripting languages Groovy etc math data analysis qalculate.sourceforge.net Qalculate Multipurpose modular.math.washington.edu/sage SAGE open-source teaching number theory cryptography mainly provides interfaces packages www.scipy.org/ SciPy library scientific www.mmlsoft.com/hdata/tarsia_home.php Formulator Tarsia designed teachers creating activities form jigsaws rectangular cards dominos later use class arma.sourceforge.net/ Armadillo Fast C++ matrix optional LAPACK ATLAS pari.math.u-bordeaux.fr/ Pari/GP computations www.microsoft.com/en-us/download/details.aspx id15702 Microsoft useful app www.wolfram.com/ Advanced commercial Macintosh www.maplesoft.com/ Mature maplenet.maplesoft.com/maplenet/worksheet/mapleprimes/1422_maple_studio.mw Studio Free online worksheet plotting Browser Java-Plugin Mozilla Internet Explorer Safari research.mupad.de/ MuPad Another advanced versions magma.maths.usyd.edu.au/ Magma Powerful solving computational problems www.mathworks.com/ www.mathsoft.com/ MathCAD www.labdeck.com/ MatDeck affordable cost 
Bayesian statistics,https://en.wikiversity.org/wiki/Bayesian_statistics,"Bayesian vs. Frequentist Statistics Resampling Computation Typically question one attempts answer using statistics relationship two variables demonstrate experimenter must show variable changes second amount change would likely mere chance alone ways figure probability event first mathematical calculation determine often happen observe happens counting number times could also actually use person say rolling six sided die figured figuring divide total possible outcomes Another example well shuffled deck cards drawing three four fifty since numbered card suite diamonds thirteen suites Sometimes size space different events known case need system count versus n't instance warranty coffee maker statement manufacturer calculates stop working period ends low way calculated involves testing calculate long typical continues function uses specify device actual life span made makers parts make Experiments Outcomes Events easiest think terms experiments potential Many examples drawn everyday experience drive home work encounter flat tire uneventful outcome election include either win candidate B C runoff Definition entire collection experiment termed sample indicated Omega simplest albeit uninteresting elementary set theory express follows interesting result 1,2,3,4,5,6 may interested subset interest might even b less expressed 2,4,6\ 1,2 borrow definitions refresher terminology new important later represents Union Venn_A_union_B.png Intersection Venn_A_intersect_B.svg c complement odd dice difference queen spades hearts clubs represent impossible certain called disjoint A\cap Probability know bit likelihood occurring classical definition comes following perform repeatable gives rise keep track repeat large enough P N_ N occurred repeated Therefore equation read equals occurs divided approaches infinity fraction true value clearly 0 1 time observed whenever simultaneously union equal plus A\cup Given arrive point worth remembering end see Well let consider define Queen Spade immediately clear draw spade queens putting back shuffling statisticians refer sampling replacement 13 argument obtain 4 expression translated incorrectly assume simply add probabilities together gather data experimentally find results differ prediction slightly twice 52 Introduction Statistics/Still confused Proof avoid double problem exactly specifying sets desired B\cap Whew proof hope dry Conditional conditional occurrence coupling weak One become probable depending knowledge another friends relatives call asking money higher lottery Let get formal remember original Consider additional situation trials record words top bottom A|B spoken takes sound given Bayes Law Wikipedia theorem|Bayes theorem cornerstone states B|A easy prove start identical expressions Since simple rearrangement line us Independence Two independent absolutely effect Mathematically Note implies adding information irrelevant towards determining Random Variables usually integers real numbers conducting poll becomes little cumbersome present individual respondant ten people voting preferences Republican R Democrat electorial districts look like RRRDRRDRRR\ DDDDDRDDDD\ probably overall breakdown preference district assign integer concise summary Discrete Continuous subclasses random discrete DRV continuous CRV take countably many values means list finite X a0 a1 a2 p0P Xa0 p1P Xa1 p2P Xa2 pnP Xan probabilites greater zero extremely separately particular small considered Xx Distribution Functions Expectation Values Hypothesis Testing Guide research Statistical Economics Actuarial mathematics Likelihood Theory Classical 202 Business Decisions External links Mathematics "
Introduction to statistics,https://en.wikiversity.org/wiki/Introduction_to_statistics,"46 people polled enjoy vanilla 54 prefer chocolate margin error school graduation rate increased 2 couple 4 boys pregnant chance another boy 88 questioned feel humane put stray animals sleep basic examples statistics see every day really understand mean study hear hopefully become little clear Introduction Statistics permeated probability understanding critical mathematical underpinning Strictly speaking word means one measures describing characteristics population use term idiomatic sense everything sampling establishment statistical procedures make statement relationship independent variables dependent Typically question attempts answer using two demonstrate experimenter must show variable changes second amount change would likely mere alone ways figure event first calculation determine often happen observe happens counting number times could also actually person say rolling six sided dice figured figuring divide total possible outcomes Another example well shuffled deck cards drawing three four fifty since numbered card suite diamonds thirteen suites Sometimes size space different events known case need system count versus n't instance warranty coffee maker manufacturer calculates stop working period ends low way calculated involves testing calculate long typical continues function uses specify device actual life span made makers parts Experiments Outcomes Events easiest think terms experiments potential Many drawn everyday experience drive home work encounter flat tire uneventful outcome election include either win candidate B C runoff Definition entire collection experiment termed sample indicated Omega simplest albeit uninteresting elementary set theory express follows interesting result 1,2,3,4,5,6 may interested subset interest might even b less expressed 2,4,6\ 1,2 borrow definitions refresher terminology new important later represents Union Venn_A_union_B.png Intersection Venn_A_intersect_B.svg c complement odd difference queen spades hearts clubs represent impossible certain called disjoint A\cap Probability know bit likelihood occurring classical definition comes following perform repeatable gives rise keep track repeat large enough P N_ N occurred repeated Therefore equation read equals occurs divided approaches infinity fraction true value clearly 0 1 time observed whenever simultaneously union equal plus A\cup Given arrive point worth remembering end Well let consider define Queen Spade immediately draw spade queens putting back shuffling statisticians refer replacement 13 argument obtain expression translated incorrectly assume simply add probabilities together gather data experimentally find results differ prediction slightly twice 52 Statistics/Still confused Proof avoid double problem exactly specifying sets desired B\cap Whew proof hope dry Conditional conditional occurrence coupling weak One probable depending knowledge friends relatives call asking money higher lottery Let get formal remember original Consider additional situation trials record words top bottom A|B spoken takes sound given confusing problem/ Bayes Law theorem states segment B_1 B_k B_i|A A|B_i B_i n1 A|B_n B_n note substituting inequality detailed explanation en.wikipedia.org/wiki/Bayes'_theorem Independence Two absolutely effect Mathematically Random Variables usually integers real numbers conducting poll becomes cumbersome present individual respondant ten voting preferences Republican R Democrat electorial districts look like RRRDRRDRRR\ DDDDDRDDDD\ probably overall breakdown preference district assign integer concise summary adding Discrete Continuous subclasses random discrete DRV continuous CRV take countably many values list finite X a0 a1 a2 p0P Xa0 p1P Xa1 p2P Xa2 pnP Xan probabilites greater zero extremely calculating separately particular small considered Xx Distribution Functions A-B Expectation Values research Statistical Economics Actuarial mathematics Likelihood Theory Classical 202 Bayesian Business Decisions Mathematics Introductions "
Fundamentals of probability and statistics,https://en.wikiversity.org/wiki/Fundamentals_of_probability_and_statistics,"statistics used Statistics provide way describe behavior person thing collection persons things instance sport sports performance players Knowing one baseball player hitter another batting help coach know needs additional improve average make decisions uncertain quantities involved decision insurance industry insurability people well determine rate charge determining length product warranties track good use making involving stock market lottery tickets buy studied Ancient Greeks However began earnest 1600s.www.anselm.edu/homepage/jpitocch/biostatstime.html Probability consider man evolved ages Stone Age Bronze Iron could basis discussion expressing knowledge belief event occur occurred may actually history defined Looking definition probability seems existed walked earth made today life based facts likely Similarly stone age also occurrence likelihood success failure early generalised educated definitions means every element implies time primitive stage start using tools playing vital role chances methods going work like dressing necessarily guarantee warmth function clothing dress fashion sake either covering Animals survival go hunting expecting catch prey find meal possibility might prey_ measured instincts survive fight Taking example lions high school hyenas due large numbers hyena fail always scare Mordern day mathematicians however many systems come formulae would constructive certain occurrences Take lotto set six drawn chance 12 million win jackpot gurus suggest least plays 72 sets reduces base played higher winning exchange Investment basing fact modules p align right Measurements two basic concepts studying understand variable measurement represents something change wanting variables 1 number hits 2 times bat calculate must observe desired ability hit ball successfully take measurements case computed taking able Different different counts often miss games illness injury fewer examples meals served restaurant price houses neighborhood miles driven per gallon gas consumed students classroom type pie low temperature Notice list types counted financial figures amounts amount money someone paid particular house meaning really classifications objects apple chocolate banana cream four kinds uses statistical procedures Level placeholders names replaced usually Nominal compared see equal unequal kind comparison nominal remembered named added feature ordinal rank order Ordinal less greater subtracted standard intervals ordered interval separated scale arithmetic addition subtraction possible Interval say units ordinals ratio ratios values fixed zero point better explain differences lets look levels cases convert level Examples pies remember religious preference class student Catholic Baptist Muslim Hindu finish position horse race finishes sequence first place second third taste drinks Flavor ranked choice degrees Celsius arbitrary freezing water compare 5 10 gallons flushing toilets non-arbitrary specific slices pizza eaten Tendency Descriptive Inferential descriptive sample population inferential infer characteristics Central tendency direction central expressed mean though express Grade Point Average GPA measure computations learn quite divided major descriptions much vary variance Descriptions mode median deviation range dependent Typically question attempts answer relationship demonstrate experimenter show changes mere alone ways figure mathematical calculation happen happens counting rolling sided die figured figuring divide total outcomes Another shuffled deck cards drawing three fifty since numbered card suite diamonds thirteen suites Sometimes size space events known need system count versus n't warranty coffee maker statement manufacturer calculates stop working period ends calculated involves testing long typical continues specify device actual span makers parts Experiments Outcomes Events easiest think terms experiments potential Many everyday experience drive home encounter flat tire uneventful outcome election include candidate B C runoff Definition entire experiment termed indicated Omega simplest albeit uninteresting elementary theory follows interesting result dice 1,2,3,4,5,6 interested subset interest even b 2,4,6\ 1,2 borrow refresher terminology new important later Union Venn_A_union_B.png Intersection Venn_A_intersect_B.svg c complement odd difference queen spades hearts clubs represent impossible called disjoint A\cap bit occurring classical comes following perform repeatable gives rise keep repeat enough P N_ N repeated Therefore equation read equals occurs approaches infinity fraction true value clearly 0 observed whenever simultaneously 20 union plus A\cup Given arrive worth remembering end Well let define Queen Spade immediately clear draw spade queens putting back shuffling statisticians refer sampling replacement 13 argument obtain 4 expression translated incorrectly assume simply add probabilities together gather data experimentally results differ prediction—the slightly twice 52 subtract Introduction Statistics/Still confused Proof avoid double problem exactly specifying B\cap Whew proof hope dry Conditional See Probability/Conditional venn 12345.svg|right|thumb|P even|prime prime|even 1-10.svg|right|210px|thumb|P conditional coupling weak One become probable depending friends relatives call asking formal begin Consider situation trials record words top bottom get A|B spoken takes sound given Bayes Law theorem states B|A easy prove identical expressions Since Simple rearrangement line us Independence Two independent absolutely effect Mathematically Random Variables integers real conducting poll becomes little cumbersome present individual respondent Let ten voting preferences Republican R Democrat electorial districts RRRDRRDRRR\ DDDDDRDDDD\ probably overall breakdown district assign integer concise summary adding Discrete Continuous subclasses random discrete DRV continuous CRV countably finite X a0 a1 a2 p0P Xa0 p1P Xa1 p2P Xa2 pnP Xan extremely separately small considered Xx Expected Value value|Expected generalization concept included weighted averages denoted E overline bracket notation Example Xi 3 Using denote expectation i1 X_i 1+3+3+5 group appears w_i weight w_i\cdot 1\cdot 1+2\cdot 3+ Factor inside sum 1+\frac 4\cdot Suppose randomly selected selecting 50 elements Letting 2/4 1/4 Defining P_i nbsp research Statistical Economics Actuarial mathematics Likelihood Theory Classical 202 Bayesian Business Decisions courses video lectures nptel.ac.in/courses/117105085/ Processes Mrityunjoy Chakraborty IIT Kharagpur 2004 www.youtube.com/playlist listPL17567A1A3F5DB5E4 Primer mathematicalmonk YouTube ocw.mit.edu/courses/electrical-engineering-and-computer-science/6-041-probabilistic-systems-analysis-and-applied-probability-fall-2010 Probabilistic Systems Analysis Applied John Tsitsiklis Massachusetts Institute Technology Fall 2010 videos ocw.mit.edu/courses/electrical-engineering-and-computer-science/6-436j-fundamentals-of-probability-fall-2008/ Fundamentals David Gamarnik 2008 dept.stat.lsa.umich.edu/~ionides/620/ Stochastic Modeling Edward Ionides University Michigan 2013 math.tntech.edu/e-stat/4470/ Motoya Machida Tennessee Tech math.tntech.edu/e-stat/4480/ II Spring 2011 circuit.ucsd.edu/~tjavidi/153/153/Home.html Tara Javidi California San Diego 2012 math.arizona.edu/~jwatkins/math363s13s.htm Methods Joseph C. Watkins Arizona www2.bc.edu/~baglivo/MT426/MT426.html Jenny Baglivo Boston College www2.bc.edu/~baglivo/MT427/MT427.html Mathematical www2.bc.edu/~baglivo/MT853/MT853.html Modern 2014 stat.duke.edu/courses/Spring12/sta104.1/ Colin Rundel Duke www.stats.ox.ac.uk/~winkel/bs3a07.pdf Matthias Winkel Oxford www.cl.cam.ac.uk/teaching/0708/Probabilty/ Frank King Cambridge 2007–08 www.coe.utah.edu/~cs5960-02/ Nonparametric Tom Fletcher Utah 2009 www.ee.iitm.ac.in/~skrishna/ee511/index.html Communication B. Srikrishna Madras Jul-Nov 2007 sheets stat.duke.edu/courses/Spring12/sta104.1/formula.pdf Formula Sheet www.tug.org/texshowcase/cheat.pdf Theoretical Computer Science Cheat web.stanford.edu/class/ee178/cheat_sheet.pdf Gowtham Kumar matthias.vallentin.net/probability-and-statistics-cookbook/cookbook-en.pdf Cookbook Vallentin www.math.ubc.ca/~feldman/m420/measureReview.pdf Review Measure Joel Feldman www.ee.columbia.edu/~vittorio/probability.pdf Refresher Vittorio Castelli www.cheat-sheets.org/saved-copy/prob-cheat-sheet.pdf Ingmar Land 2005 mste.illinois.edu/projects/aims/files/2007/lpitt/combinatorics-cheat-sheet.doc Combinatorics Lenny Pitt resources mathworld.wolfram.com/topics/ProbabilityandStatistics.html Wolfram MathWorld math.tntech.edu/e-stat/ e-Statistics Dept Maths onlinestatbook.com/2/index.html Online Education Rice Lead Developer Houston Clear Lake Tufts Category paradoxes|Category paradoxes Wikipedia proofwiki.org/wiki/Category Probability_Theory ProofWiki www.columbia.edu/~ks20/FE-Notes/FE-Notes-Sigman.html Notes Financial Engineering K. Sigman Columbia www-stat.stanford.edu/~susan/surprise/ Surprise Susan Holmes www.gametheory.net/applets/probability.html GameTheory.net www.stat.tamu.edu/~jhardin/applets/index.html Java Applets provided James W. Hardin www.cs.uiowa.edu/~rlenth/Power/ applets power Russ Lenth wise.cgu.edu/ Web Interface Claremont Graduate "
Philosophy of mathematics/Georg Cantor,https://en.wikiversity.org/wiki/Philosophy_of_mathematics/Georg_Cantor,According modern set theory originally based Cantor seminal ideas union two infinite disjoint classes odd even natural numbers number members either constituent class violates logical principle distinct cardinal resulting therefore constructed cost abandoning related principles casting aside readily understood favour system axioms definitions constitutes foundation mathematics largely precludes challenge basis Cantorian subsequent theories danger state affairs foundations radically altered thus precluding advances might result reappraisal infinity intuitive illustration seem counter-intuitive first simple thought experiment provide us feel theorem trick simply count rarr 1 3 5 7 n 2n-1 n+1 2 Mathematics realise time tired counting never run appear order notable exception rule made infinitely many sets fact larger member according Hilbert paradox Grand Hotel|Hilbert Hotel 
